{"schema":"nightshift.operational-observation-lineage/v1","lineage_id":"sha256:b5728edc8eb9547386601253ff02a14dc1c17ba456e5720ac3734f3da4742a18","monitor_result_head":"b2d52fe34f146774cbf5601819982c267c7fb082","nq_result_head":"39b9f84f2f70955dd12e5cbfe798c740f9e52854","monitor_custody":{"raw_bytes_sha256":"sha256:319f2324bcb24eb9f029cc366f98823661a9cc059f5bef923aee55d18ecbacb9","raw_bytes_length":2163,"semantic_digest":"sha256:4417827eddace3aa8071d1bcedb84fb58f9c49ed205976be3b29599d25b0434c"},"nq_custody":{"raw_bytes_sha256":"sha256:f38771e81df629fe4863a527a614168b6c956511c4bad265f3e31a1e4e7de4fa","raw_bytes_length":81614,"semantic_digest":"sha256:d6325dbcc1db4de9680fe7bd5cf82db1431a891babe0bb3f6d18f7020ab475be"},"nq_profile_id":"profile:silicon-orchard-ecad-stage:v1","nq_input_id":"silicon:scheduler-contradiction-a","subject":{"kind":"stage_occurrence","namespace":"ecad:open-counter","basis_contract":"monitor.subject-basis.stage-occurrence/v1","stable_basis":{"basis_type":"stage_occurrence","run_identity":"sha256:564080edbf33cab56b307436ab49260c4bac3fd95fd3df545cfbef222c9d5e17","stage_occurrence_identity":"sha256:865b85007d9a27de3520dcef242bbcb69db17f6e5ea6e0d6db1355082be9ee5f"}},"subject_identity_digest":"sha256:2ae08e42382e6d7b9a3e36da695c4bc2f01bbd08e41b869dcfafd4c073f940dd","producer":{"principal_id":"producer:silicon-orchard","collector_id":"collector:ecad-fixture","key_algorithm":"ed25519","public_key_hex":"43046bfe4092b3e94994eada15dcc20d8aaa07b658fd3954eb8e0efb8bdca5de","public_key_digest":"sha256:23d536e9bc640cfdc8856a8662c1ac3fc45e3c6fd3980e96c6ad95cf26a79c2f","producer_class":"instrumented_monitor"},"producer_identity_digest":"sha256:62632d93d8a1cb13ab7cc4d610a90e36288b67f4e7de111681bf5d6c1dc7524a","acquisition_outcome":"observation_produced","acquisition_started_at":"2026-08-30T15:59:00Z","acquisition_ended_at":"2026-08-30T16:00:00Z","producer_observed_at":"2026-08-30T16:00:00Z","receiver_custody_at":"2026-08-30T16:01:00Z","nq_qualified_at":"2026-08-30T16:02:00Z","nightshift_admitted_at":"2026-08-30T16:02:01Z","epoch":"epoch:silicon:scheduler-contradiction-a","sequence":0,"predecessor_observation_digest":null,"payload_schema":"monitor.ecad-stage-observation/v1","claim_support":[{"claim_id":"ecad:design-revision","proposition":"exact ECAD design revision identity","value_digest":"sha256:da1497dac6f872ea70ee4260c1cee22089d03f80295e1935dfe964d885d0014d","monitor_record_digest":"sha256:4417827eddace3aa8071d1bcedb84fb58f9c49ed205976be3b29599d25b0434c"},{"claim_id":"ecad:input-artifact","proposition":"exact input artifact-set identity","value_digest":"sha256:3b06decef940c7d43bd2c0b3043c0678486ad8798745fe2e28ed2d50d18ed22b","monitor_record_digest":"sha256:4417827eddace3aa8071d1bcedb84fb58f9c49ed205976be3b29599d25b0434c"},{"claim_id":"ecad:license","proposition":"observed license response","value_digest":"sha256:8b7092cc4b053d88fdfb7df09c11c9242c36aba5d07e422786913868eda34bfc","monitor_record_digest":"sha256:4417827eddace3aa8071d1bcedb84fb58f9c49ed205976be3b29599d25b0434c"},{"claim_id":"ecad:license-identity","proposition":"exact license entitlement identity","value_digest":"sha256:39b085a4293ef08852bad17c60d5b48c3dc60d3455ec2eef379bc68a1f18249c","monitor_record_digest":"sha256:4417827eddace3aa8071d1bcedb84fb58f9c49ed205976be3b29599d25b0434c"},{"claim_id":"ecad:output-artifact","proposition":"exact output artifact-set identity","value_digest":"sha256:58448d6e6e28b846be457a35d7ddbc9662c95d9da88c039a2524760fab26d466","monitor_record_digest":"sha256:4417827eddace3aa8071d1bcedb84fb58f9c49ed205976be3b29599d25b0434c"},{"claim_id":"ecad:output-present","proposition":"output presence observation","value_digest":"sha256:b5bea41b6c623f7c09f1bf24dcae58ebab3c0cdd90ad966bc43a45b44867e12b","monitor_record_digest":"sha256:4417827eddace3aa8071d1bcedb84fb58f9c49ed205976be3b29599d25b0434c"},{"claim_id":"ecad:output-digest-match","proposition":"output digest comparison observation","value_digest":"sha256:b5bea41b6c623f7c09f1bf24dcae58ebab3c0cdd90ad966bc43a45b44867e12b","monitor_record_digest":"sha256:4417827eddace3aa8071d1bcedb84fb58f9c49ed205976be3b29599d25b0434c"},{"claim_id":"ecad:pdk-identity","proposition":"exact PDK identity","value_digest":"sha256:30610d97535a1f1250d9bde93fc6283c6180a68bff23a8867ac884b2411aa884","monitor_record_digest":"sha256:4417827eddace3aa8071d1bcedb84fb58f9c49ed205976be3b29599d25b0434c"},{"claim_id":"ecad:pdk-match","proposition":"PDK comparison observation","value_digest":"sha256:b5bea41b6c623f7c09f1bf24dcae58ebab3c0cdd90ad966bc43a45b44867e12b","monitor_record_digest":"sha256:4417827eddace3aa8071d1bcedb84fb58f9c49ed205976be3b29599d25b0434c"},{"claim_id":"ecad:repository-revision","proposition":"exact repository revision identity","value_digest":"sha256:1b87225ddb369ca045389f1e35c0261c9da37a0f2a5349cfae9c5cf757b41c31","monitor_record_digest":"sha256:4417827eddace3aa8071d1bcedb84fb58f9c49ed205976be3b29599d25b0434c"},{"claim_id":"ecad:repository-revision-match","proposition":"repository revision comparison observation","value_digest":"sha256:b5bea41b6c623f7c09f1bf24dcae58ebab3c0cdd90ad966bc43a45b44867e12b","monitor_record_digest":"sha256:4417827eddace3aa8071d1bcedb84fb58f9c49ed205976be3b29599d25b0434c"},{"claim_id":"ecad:scheduler-job","proposition":"exact scheduler-job occurrence identity","value_digest":"sha256:6e04d52b8f3e9ff40a9df85f7210c7e545034f07fd200fe1f017615a7484597c","monitor_record_digest":"sha256:4417827eddace3aa8071d1bcedb84fb58f9c49ed205976be3b29599d25b0434c"},{"claim_id":"ecad:scheduler-observation","proposition":"scheduler observation","value_digest":"sha256:79d116a0c160c52732ff18be65ce4681d3bdf027cafd522cd1e076e816304379","monitor_record_digest":"sha256:4417827eddace3aa8071d1bcedb84fb58f9c49ed205976be3b29599d25b0434c"},{"claim_id":"ecad:stage-occurrence","proposition":"exact stage occurrence identity","value_digest":"sha256:5cd2476ac1dbc4ba22a4884c427bcd19600ada81e65d7ec29163bc1f7b22fe7b","monitor_record_digest":"sha256:4417827eddace3aa8071d1bcedb84fb58f9c49ed205976be3b29599d25b0434c"},{"claim_id":"ecad:stage-name","proposition":"stage name observation","value_digest":"sha256:2ad47ffa2c44e63f601770d25d4ca879bf9edef3a1ead64bcf60f905f33496f0","monitor_record_digest":"sha256:4417827eddace3aa8071d1bcedb84fb58f9c49ed205976be3b29599d25b0434c"},{"claim_id":"ecad:toolchain-identity","proposition":"exact toolchain identity","value_digest":"sha256:d0e6563db1ad19ac1aae7fcc67cebeacf33967f7e5b2077d8b63c3a105ab96c9","monitor_record_digest":"sha256:4417827eddace3aa8071d1bcedb84fb58f9c49ed205976be3b29599d25b0434c"},{"claim_id":"ecad:toolchain-match","proposition":"toolchain comparison observation","value_digest":"sha256:b5bea41b6c623f7c09f1bf24dcae58ebab3c0cdd90ad966bc43a45b44867e12b","monitor_record_digest":"sha256:4417827eddace3aa8071d1bcedb84fb58f9c49ed205976be3b29599d25b0434c"},{"claim_id":"ecad:worker-identity","proposition":"exact worker identity","value_digest":"sha256:0b2c20c7c0d81961ad9f7d31b55dfc5dbd73ed8f3a095e29e0f9d56fd9f964ad","monitor_record_digest":"sha256:4417827eddace3aa8071d1bcedb84fb58f9c49ed205976be3b29599d25b0434c"},{"claim_id":"ecad:worker-observation","proposition":"worker observation","value_digest":"sha256:94332144d941eb1212c9af7f968e215a7042bf94925c9c10b21de97a2f0cea06","monitor_record_digest":"sha256:4417827eddace3aa8071d1bcedb84fb58f9c49ed205976be3b29599d25b0434c"},{"claim_id":"ecad:artifact-observed-at","proposition":"artifact observation time","value_digest":"sha256:19466be86fa2441746800c7b345c30db23b919850d8e6d5b57edbd9618570f86","monitor_record_digest":"sha256:4417827eddace3aa8071d1bcedb84fb58f9c49ed205976be3b29599d25b0434c"},{"claim_id":"ecad:process-exit-code","proposition":"process exit code as mechanics only","value_digest":"sha256:5feceb66ffc86f38d952786c6d696c79c2dbc239dd4e91b46729d73a27fb57e9","monitor_record_digest":"sha256:4417827eddace3aa8071d1bcedb84fb58f9c49ed205976be3b29599d25b0434c"}],"cannot_testify":[],"refusals":[],"contradictions":[{"subject_identity_digest":"sha256:2ae08e42382e6d7b9a3e36da695c4bc2f01bbd08e41b869dcfafd4c073f940dd","claim_id":"ecad:scheduler-observation","first_input_id":"silicon:scheduler-contradiction-a","first_value_digest":"sha256:79d116a0c160c52732ff18be65ce4681d3bdf027cafd522cd1e076e816304379","second_input_id":"silicon:scheduler-contradiction-b","second_value_digest":"sha256:06234c1cf33df85364aedb5de2e65dc2fcb144ff65a249457c5f140fde7ee1d4"},{"subject_identity_digest":"sha256:2ae08e42382e6d7b9a3e36da695c4bc2f01bbd08e41b869dcfafd4c073f940dd","claim_id":"ecad:scheduler-observation","first_input_id":"silicon:scheduler-contradiction-a","first_value_digest":"sha256:79d116a0c160c52732ff18be65ce4681d3bdf027cafd522cd1e076e816304379","second_input_id":"silicon:agent-contradiction","second_value_digest":"sha256:06234c1cf33df85364aedb5de2e65dc2fcb144ff65a249457c5f140fde7ee1d4"}],"nonclaims":["lineage is temporal custody, not claim qualification","currentness is not standing, authorization, or permission to act","producer class does not establish evidentiary precedence","re-observation may acquire testimony but cannot remediate a target"]}