{"schema":"nightshift.operational-observation-lineage/v1","lineage_id":"sha256:c53a6c9809b121b4c72fb39409dd452cadf922bb47662e00e2c9ba6414ace55c","monitor_result_head":"b2d52fe34f146774cbf5601819982c267c7fb082","nq_result_head":"39b9f84f2f70955dd12e5cbfe798c740f9e52854","monitor_custody":{"raw_bytes_sha256":"sha256:e1f2a536575d5161b9472d97e24718b08fde820049beb0ad2af12205b875e0a9","raw_bytes_length":2165,"semantic_digest":"sha256:c9db8f5b88031a0c36d10907a503a93aadddafbcdd36878475f684fbcff5163c"},"nq_custody":{"raw_bytes_sha256":"sha256:e6c859b14d15d0939714ab27af63c28399989fb9da71c560a4a6bbb84f187fce","raw_bytes_length":8629,"semantic_digest":"sha256:e6c859b14d15d0939714ab27af63c28399989fb9da71c560a4a6bbb84f187fce"},"nq_profile_id":"profile:silicon-orchard-ecad-stage:v1","nq_input_id":"silicon:repository-custody-historical","subject":{"kind":"stage_occurrence","namespace":"ecad:open-counter","basis_contract":"monitor.subject-basis.stage-occurrence/v1","stable_basis":{"basis_type":"stage_occurrence","run_identity":"sha256:564080edbf33cab56b307436ab49260c4bac3fd95fd3df545cfbef222c9d5e17","stage_occurrence_identity":"sha256:b753f22d88f506563927adfc84f6d8437eedf5fb0beadd4de8c2e7f9b7bc12f1"}},"subject_identity_digest":"sha256:b189d8cdde834f7ee20f288a63169b883a35bb779604a48dc3f67c69de8ff1df","producer":{"principal_id":"producer:silicon:repository_monitor","collector_id":"collector:ecad-fixture","key_algorithm":"ed25519","public_key_hex":"6e32c19741f0af8260612ae99fd13d8a38944722e08964dd239738f552a6153b","public_key_digest":"sha256:151704051f09c42063fb8e3795d69f18eb602f492c452fd574945b07ced93b66","producer_class":"repository_monitor"},"producer_identity_digest":"sha256:2b1739cd369053860e35b1e94561705abdd0ad76ace255f17c1e8011e5218bef","acquisition_outcome":"observation_produced","acquisition_started_at":"2026-08-29T15:59:00Z","acquisition_ended_at":"2026-08-29T16:00:00Z","producer_observed_at":"2026-08-29T16:00:00Z","receiver_custody_at":"2026-08-30T16:30:00Z","nq_qualified_at":"2026-08-30T16:40:00Z","nightshift_admitted_at":"2026-08-30T16:41:00Z","epoch":"epoch:silicon:repository-custody","sequence":0,"predecessor_observation_digest":null,"payload_schema":"monitor.ecad-stage-observation/v1","claim_support":[{"claim_id":"ecad:design-revision","proposition":"exact ECAD design revision identity","value_digest":"sha256:da1497dac6f872ea70ee4260c1cee22089d03f80295e1935dfe964d885d0014d","monitor_record_digest":"sha256:c9db8f5b88031a0c36d10907a503a93aadddafbcdd36878475f684fbcff5163c"},{"claim_id":"ecad:observed-design-revision","proposition":"exact observed ECAD design revision identity","value_digest":"sha256:da1497dac6f872ea70ee4260c1cee22089d03f80295e1935dfe964d885d0014d","monitor_record_digest":"sha256:c9db8f5b88031a0c36d10907a503a93aadddafbcdd36878475f684fbcff5163c"},{"claim_id":"ecad:design-revision-match","proposition":"design revision comparison observation","value_digest":"sha256:b5bea41b6c623f7c09f1bf24dcae58ebab3c0cdd90ad966bc43a45b44867e12b","monitor_record_digest":"sha256:c9db8f5b88031a0c36d10907a503a93aadddafbcdd36878475f684fbcff5163c"},{"claim_id":"ecad:input-artifact","proposition":"exact input artifact-set identity","value_digest":"sha256:3b06decef940c7d43bd2c0b3043c0678486ad8798745fe2e28ed2d50d18ed22b","monitor_record_digest":"sha256:c9db8f5b88031a0c36d10907a503a93aadddafbcdd36878475f684fbcff5163c"},{"claim_id":"ecad:license","proposition":"observed license response","value_digest":"sha256:8b7092cc4b053d88fdfb7df09c11c9242c36aba5d07e422786913868eda34bfc","monitor_record_digest":"sha256:c9db8f5b88031a0c36d10907a503a93aadddafbcdd36878475f684fbcff5163c"},{"claim_id":"ecad:license-identity","proposition":"exact license entitlement identity","value_digest":"sha256:39b085a4293ef08852bad17c60d5b48c3dc60d3455ec2eef379bc68a1f18249c","monitor_record_digest":"sha256:c9db8f5b88031a0c36d10907a503a93aadddafbcdd36878475f684fbcff5163c"},{"claim_id":"ecad:output-artifact","proposition":"exact output artifact-set identity","value_digest":"sha256:856181e9b02a4d668b8bb8ce323ea87478432cbb9c21bc36039053808a230650","monitor_record_digest":"sha256:c9db8f5b88031a0c36d10907a503a93aadddafbcdd36878475f684fbcff5163c"},{"claim_id":"ecad:observed-output-artifact","proposition":"exact observed output artifact-set identity or absence","value_digest":"sha256:856181e9b02a4d668b8bb8ce323ea87478432cbb9c21bc36039053808a230650","monitor_record_digest":"sha256:c9db8f5b88031a0c36d10907a503a93aadddafbcdd36878475f684fbcff5163c"},{"claim_id":"ecad:output-present","proposition":"output presence observation","value_digest":"sha256:b5bea41b6c623f7c09f1bf24dcae58ebab3c0cdd90ad966bc43a45b44867e12b","monitor_record_digest":"sha256:c9db8f5b88031a0c36d10907a503a93aadddafbcdd36878475f684fbcff5163c"},{"claim_id":"ecad:output-digest-match","proposition":"output digest comparison observation","value_digest":"sha256:b5bea41b6c623f7c09f1bf24dcae58ebab3c0cdd90ad966bc43a45b44867e12b","monitor_record_digest":"sha256:c9db8f5b88031a0c36d10907a503a93aadddafbcdd36878475f684fbcff5163c"},{"claim_id":"ecad:pdk-identity","proposition":"exact PDK identity","value_digest":"sha256:30610d97535a1f1250d9bde93fc6283c6180a68bff23a8867ac884b2411aa884","monitor_record_digest":"sha256:c9db8f5b88031a0c36d10907a503a93aadddafbcdd36878475f684fbcff5163c"},{"claim_id":"ecad:observed-pdk-identity","proposition":"exact observed PDK identity","value_digest":"sha256:30610d97535a1f1250d9bde93fc6283c6180a68bff23a8867ac884b2411aa884","monitor_record_digest":"sha256:c9db8f5b88031a0c36d10907a503a93aadddafbcdd36878475f684fbcff5163c"},{"claim_id":"ecad:pdk-match","proposition":"PDK comparison observation","value_digest":"sha256:b5bea41b6c623f7c09f1bf24dcae58ebab3c0cdd90ad966bc43a45b44867e12b","monitor_record_digest":"sha256:c9db8f5b88031a0c36d10907a503a93aadddafbcdd36878475f684fbcff5163c"},{"claim_id":"ecad:repository-revision","proposition":"exact repository revision identity","value_digest":"sha256:1b87225ddb369ca045389f1e35c0261c9da37a0f2a5349cfae9c5cf757b41c31","monitor_record_digest":"sha256:c9db8f5b88031a0c36d10907a503a93aadddafbcdd36878475f684fbcff5163c"},{"claim_id":"ecad:observed-repository-revision","proposition":"exact observed repository revision identity","value_digest":"sha256:7f1ca883dce353edc9512f6c6f229a8a1f2fbb43c43fb3cc281bed7edaea4b47","monitor_record_digest":"sha256:c9db8f5b88031a0c36d10907a503a93aadddafbcdd36878475f684fbcff5163c"},{"claim_id":"ecad:repository-revision-match","proposition":"repository revision comparison observation","value_digest":"sha256:fcbcf165908dd18a9e49f7ff27810176db8e9f63b4352213741664245224f8aa","monitor_record_digest":"sha256:c9db8f5b88031a0c36d10907a503a93aadddafbcdd36878475f684fbcff5163c"},{"claim_id":"ecad:scheduler-job","proposition":"exact scheduler-job occurrence identity","value_digest":"sha256:6e04d52b8f3e9ff40a9df85f7210c7e545034f07fd200fe1f017615a7484597c","monitor_record_digest":"sha256:c9db8f5b88031a0c36d10907a503a93aadddafbcdd36878475f684fbcff5163c"},{"claim_id":"ecad:scheduler-observation","proposition":"scheduler observation","value_digest":"sha256:7093fda846e50b267da144f7b3683ee1dd8838506939f6052b7370dd01fa2ad0","monitor_record_digest":"sha256:c9db8f5b88031a0c36d10907a503a93aadddafbcdd36878475f684fbcff5163c"},{"claim_id":"ecad:stage-occurrence","proposition":"exact stage occurrence identity","value_digest":"sha256:52201b67853f97e6239a251a762be6b6fae1495599a26d78e0fac66aeeb19a8c","monitor_record_digest":"sha256:c9db8f5b88031a0c36d10907a503a93aadddafbcdd36878475f684fbcff5163c"},{"claim_id":"ecad:stage-name","proposition":"stage name observation","value_digest":"sha256:2ad47ffa2c44e63f601770d25d4ca879bf9edef3a1ead64bcf60f905f33496f0","monitor_record_digest":"sha256:c9db8f5b88031a0c36d10907a503a93aadddafbcdd36878475f684fbcff5163c"},{"claim_id":"ecad:toolchain-identity","proposition":"exact toolchain identity","value_digest":"sha256:d0e6563db1ad19ac1aae7fcc67cebeacf33967f7e5b2077d8b63c3a105ab96c9","monitor_record_digest":"sha256:c9db8f5b88031a0c36d10907a503a93aadddafbcdd36878475f684fbcff5163c"},{"claim_id":"ecad:observed-toolchain-identity","proposition":"exact observed toolchain identity","value_digest":"sha256:d0e6563db1ad19ac1aae7fcc67cebeacf33967f7e5b2077d8b63c3a105ab96c9","monitor_record_digest":"sha256:c9db8f5b88031a0c36d10907a503a93aadddafbcdd36878475f684fbcff5163c"},{"claim_id":"ecad:toolchain-match","proposition":"toolchain comparison observation","value_digest":"sha256:b5bea41b6c623f7c09f1bf24dcae58ebab3c0cdd90ad966bc43a45b44867e12b","monitor_record_digest":"sha256:c9db8f5b88031a0c36d10907a503a93aadddafbcdd36878475f684fbcff5163c"},{"claim_id":"ecad:worker-identity","proposition":"exact worker identity","value_digest":"sha256:0b2c20c7c0d81961ad9f7d31b55dfc5dbd73ed8f3a095e29e0f9d56fd9f964ad","monitor_record_digest":"sha256:c9db8f5b88031a0c36d10907a503a93aadddafbcdd36878475f684fbcff5163c"},{"claim_id":"ecad:worker-observation","proposition":"worker observation","value_digest":"sha256:94332144d941eb1212c9af7f968e215a7042bf94925c9c10b21de97a2f0cea06","monitor_record_digest":"sha256:c9db8f5b88031a0c36d10907a503a93aadddafbcdd36878475f684fbcff5163c"},{"claim_id":"ecad:artifact-observed-at","proposition":"artifact observation time","value_digest":"sha256:009a5a35efe62308e35c053509887ba28569dec0a3b25eef12e491b7b3ac2b22","monitor_record_digest":"sha256:c9db8f5b88031a0c36d10907a503a93aadddafbcdd36878475f684fbcff5163c"},{"claim_id":"ecad:process-exit-code","proposition":"process exit code as mechanics only","value_digest":"sha256:5feceb66ffc86f38d952786c6d696c79c2dbc239dd4e91b46729d73a27fb57e9","monitor_record_digest":"sha256:c9db8f5b88031a0c36d10907a503a93aadddafbcdd36878475f684fbcff5163c"}],"cannot_testify":[],"refusals":[],"contradictions":[],"nonclaims":["lineage is temporal custody, not claim qualification","currentness is not standing, authorization, or permission to act","producer class does not establish evidentiary precedence","re-observation may acquire testimony but cannot remediate a target"]}