{"schema":"nightshift.operational-observation-lineage/v1","lineage_id":"sha256:ab35168a2d31fe3c84cf0770100585182c6bfa981b3ecfd77f1dd6869d760385","monitor_result_head":"b2d52fe34f146774cbf5601819982c267c7fb082","nq_result_head":"39b9f84f2f70955dd12e5cbfe798c740f9e52854","monitor_custody":{"raw_bytes_sha256":"sha256:2d23c50cf1bdaa70e746549ae16bda3b0729fee9611e50c95735839c1ed5f700","raw_bytes_length":1860,"semantic_digest":"sha256:3e1682ccb62ad5adf734e3d6fcd42ce4a5e33b1da9985d194852f3d05c91a4d1"},"nq_custody":{"raw_bytes_sha256":"sha256:416abd7c7520e47be5646cb2e23a2d5ed0ea68c822db50e1bfd242c7f0d27553","raw_bytes_length":4329,"semantic_digest":"sha256:416abd7c7520e47be5646cb2e23a2d5ed0ea68c822db50e1bfd242c7f0d27553"},"nq_profile_id":"profile:silicon-orchard-ecad-stage:v1","nq_input_id":"silicon:license-no-response","subject":{"kind":"stage_occurrence","namespace":"ecad:open-counter","basis_contract":"monitor.subject-basis.stage-occurrence/v1","stable_basis":{"basis_type":"stage_occurrence","run_identity":"sha256:564080edbf33cab56b307436ab49260c4bac3fd95fd3df545cfbef222c9d5e17","stage_occurrence_identity":"sha256:58219cfef0e71833a064abf9b00a57fcca1d6572aaf954688754f19252fe5216"}},"subject_identity_digest":"sha256:117dcc2332cb243a919503d815e95b5406a061b1f3f4f0f83665c17ecb36b7e9","producer":{"principal_id":"producer:silicon:license_monitor","collector_id":"collector:ecad-fixture","key_algorithm":"ed25519","public_key_hex":"a87b8a99bd88a69686c994a80b629d8154871aa295540834c01d79f4f916502f","public_key_digest":"sha256:6c791c32ca5ac1d1af8574c0c5bb2da52ddc58aec690dcdad8400dfe8dee6a95","producer_class":"license_monitor"},"producer_identity_digest":"sha256:3043d6609a616422262f66aca29cac02d60257a85ac3c2fb3562594840e72285","acquisition_outcome":"no_response","acquisition_started_at":"2026-08-30T15:59:00Z","acquisition_ended_at":"2026-08-30T16:00:00Z","producer_observed_at":null,"receiver_custody_at":"2026-08-30T16:30:00Z","nq_qualified_at":"2026-08-30T16:40:00Z","nightshift_admitted_at":"2026-08-30T16:41:00Z","epoch":"epoch:silicon:license-no-response","sequence":0,"predecessor_observation_digest":null,"payload_schema":null,"claim_support":[],"cannot_testify":[{"claim_id":"ecad:design-revision","reason":"Monitor acquisition outcome no_response produced no world testimony"},{"claim_id":"ecad:observed-design-revision","reason":"Monitor acquisition outcome no_response produced no world testimony"},{"claim_id":"ecad:design-revision-match","reason":"Monitor acquisition outcome no_response produced no world testimony"},{"claim_id":"ecad:input-artifact","reason":"Monitor acquisition outcome no_response produced no world testimony"},{"claim_id":"ecad:license","reason":"Monitor acquisition outcome no_response produced no world testimony"},{"claim_id":"ecad:license-identity","reason":"Monitor acquisition outcome no_response produced no world testimony"},{"claim_id":"ecad:output-artifact","reason":"Monitor acquisition outcome no_response produced no world testimony"},{"claim_id":"ecad:observed-output-artifact","reason":"Monitor acquisition outcome no_response produced no world testimony"},{"claim_id":"ecad:output-present","reason":"Monitor acquisition outcome no_response produced no world testimony"},{"claim_id":"ecad:output-digest-match","reason":"Monitor acquisition outcome no_response produced no world testimony"},{"claim_id":"ecad:pdk-identity","reason":"Monitor acquisition outcome no_response produced no world testimony"},{"claim_id":"ecad:observed-pdk-identity","reason":"Monitor acquisition outcome no_response produced no world testimony"},{"claim_id":"ecad:pdk-match","reason":"Monitor acquisition outcome no_response produced no world testimony"},{"claim_id":"ecad:repository-revision","reason":"Monitor acquisition outcome no_response produced no world testimony"},{"claim_id":"ecad:observed-repository-revision","reason":"Monitor acquisition outcome no_response produced no world testimony"},{"claim_id":"ecad:repository-revision-match","reason":"Monitor acquisition outcome no_response produced no world testimony"},{"claim_id":"ecad:scheduler-job","reason":"Monitor acquisition outcome no_response produced no world testimony"},{"claim_id":"ecad:scheduler-observation","reason":"Monitor acquisition outcome no_response produced no world testimony"},{"claim_id":"ecad:stage-occurrence","reason":"Monitor acquisition outcome no_response produced no world testimony"},{"claim_id":"ecad:stage-name","reason":"Monitor acquisition outcome no_response produced no world testimony"},{"claim_id":"ecad:toolchain-identity","reason":"Monitor acquisition outcome no_response produced no world testimony"},{"claim_id":"ecad:observed-toolchain-identity","reason":"Monitor acquisition outcome no_response produced no world testimony"},{"claim_id":"ecad:toolchain-match","reason":"Monitor acquisition outcome no_response produced no world testimony"},{"claim_id":"ecad:worker-identity","reason":"Monitor acquisition outcome no_response produced no world testimony"},{"claim_id":"ecad:worker-observation","reason":"Monitor acquisition outcome no_response produced no world testimony"},{"claim_id":"ecad:artifact-observed-at","reason":"Monitor acquisition outcome no_response produced no world testimony"},{"claim_id":"ecad:process-exit-code","reason":"Monitor acquisition outcome no_response produced no world testimony"}],"refusals":[],"contradictions":[],"nonclaims":["lineage is temporal custody, not claim qualification","currentness is not standing, authorization, or permission to act","producer class does not establish evidentiary precedence","re-observation may acquire testimony but cannot remediate a target"]}